0,0
"Bohnanza: 25th Anniversary Edition, Bohnanza+",1
Ra: Sun God edition,2
"CATAN 3D Collector's Edition, Catan: 25 Jahre Jubiläums-Edition, Catan: 25th Anniversary Edition, CATAN: 3D Edition, Catan: Big Box, Catan: Big Box, Catan: Big Box, CATAN: Big Box, Catan: Big Box Jubileumeditie, The Settlers of Catan",3
"The Boardgame Book, Pirates of the Caribbean Dead Man's Chest: 3 in 1 Pirate Games Collector's Edition",4
Mamma Mia! con Ingredientes dobles,5
"El Grande & Carcassonne, El Grande Big Box, El Grande Decennial Edition",6
Igel Ärgern + Tante Tarantel,7
"Cambio y Bolsa, Mercado, y Miau, Classic Card Game Compendium",8
Mü and Lots More,9
Kokkelimonke Jubileum,10
"Ancient Conflict Treasure Chest, Apocalypse Pack, The Boardgame Book, Giant 30 Game Cube, Miscellaneous Game Compilation, Pirates of the Caribbean Dead Man's Chest: 3 in 1 Pirate Games Collector's Edition, Seizer's Chess",11
"Risk & Castle Risk, Spaß am Erfolg: Karriere, Das Millionenspiel, Risiko",12
"The 15 Greatest Board Games in the World, The Boardgame Book, The Book of Classic Board Games",13
Groo: The Game,14
Tichu Deluxe,15
"Playing With Pyramids, Solomids",16
"Knightmare Chess (Third Edition), Tempête sur l'Échiquier",17
Napoleon at War: Four Battles,18
Mississippi Queen,19
"Die Siedler von Catan: Das Kartenspiel - 10th Anniversary Special Edition Tin Box, Die Siedler von Catan: Das Kartenspiel - Plus Pack",20
Samarkand Bazaar,21
New Tactical Games with Dice and Cards,22
"The 15 Greatest Board Games in the World, Miscellaneous Game Compilation",23
"Family Game Night Book and Game Set: Scrabble, Clue, Sorry, Yahtzee, Scrabble / Scrabble Together, Scrabble and Yahtzee, Scrabble Plus Scrabble Junior, Twin Play Classics: Monopoly and Scrabble",24
"Catan: 25 Jahre Jubiläums-Edition, CATAN: 3D Expansions - Seafarers + Cities & Knights, Catan: Seefahrer - 20 Jahre Jubiläums-Edition",25
"El Grande Big Box, El Grande Decennial Edition, The El Grande Expansions",26
Early Railways Collection,27
Alhambra: Big Box Special Edition,28
"Take 5 & Take A Number, Take 5: 30th Anniversary Edition",29
Bohnanza: Princes & Pirates,30
"Bohnanza Erweiterungs-Set (Revised Edition), Bohnanza: 25th Anniversary Edition",31
Chez Geek: House Party edition,32
"Jockey & Grand Prix, Spiele-Box",33
"El Grande Big Box, El Grande Decennial Edition",34
Snits!,35
A Gamut of Games,36
"Carcassonne Big Box, Carcassonne Big Box 2, Carcassonne Big Box 3, Carcassonne Big Box 4, Carcassonne Big Box 5, Carcassonne Big Box 6, Carcassonne Big Box 7, Carcassonne inklusive Händler & Baumeister, Carcassonne Limited Edition, Carcassonne Müller Exklusiv-Edition, Carcassonne: 10 Year Special Edition, Carcassonne: 20th Anniversary Edition, El Grande & Carcassonne, Каркассон: Королевский Подарок, Каркассон: Королевский подарок. Новое издание",37
Roads & Boats: 20th Anniversary Edition,38
"Bohnanza: Bohnaparte & High Bohn, High Bohn Plus, High Bohn: Bohnenduell um 12 Uhr mittags",39
Mystery of the Abbey with The Pilgrims' Chronicles,40
"CATAN 3D Collector's Edition, CATAN: 3D Expansions - Seafarers + Cities & Knights",41
The Sackson Legacy Collection (Red),42
Miscellaneous Game Compilation,43
Bohnanza: Ladies & Gangsters,44
Insecta: Facsimile Edition,45
"Phase 10 Bonus Pack, UNO Bundle Collector Tin",46
"Clue / Parcheesi, Family Game Night Book and Game Set: Scrabble, Clue, Sorry, Yahtzee, Twin Play Classics: Clue and Sorry",47
"Mückenstich, Danger, Zwickern",48
Jockey & Grand Prix,49
Twin Play Classics: Monopoly and Scrabble,50
Slide 5 / Cheater,51
"HeartSwitch Wizard Combo Pack, Wizard Omnibus",52
"Spaß am Erfolg: Karriere, Das Millionenspiel, Risiko",53
"Bohnanza: Bohnaparte & High Bohn, Bohnanza+, Fasolki: Rozszerzenie",54
"World in Flames Collector's Edition Deluxe, World in Flames Deluxe Edition",55
Quick Picks Password & Password Junior,56
Cosmic Supreme,57
"The 15 Greatest Board Games in the World, AGON: 24 táblajáték a nagyvilágból, Ancient Board Games, The Reliquary Collection, The Ur Variations",58
The Game of Life / Pay Day,59
Atmosfear: The Ultimate Conflict,60
Legend of the Five Rings: Gen Con 2014 L5R Experience,61
Verkade spel,62
"Munchkin 1+2, Munchkin Big Box, Munchkin Bobblehead Edition, Munchkin Edycja Rozszerzona, Munchkin Special Holiday Edition, Munchkin Super-Mega-Set",63
Anti-Monopoly Luxus-Edition,64
5 Alive / Uno,65
Taboo Junior / Outburst Jr,66
"The 15 Greatest Board Games in the World, Ancient Conflict Treasure Chest, Apocalypse Pack, The Boardgame Book, The Book of Classic Board Games, Donald Duck Big Game Box, Duit, Five Famous Favorites, Generic Board ""Checkered"", Giant 30 Game Cube, Great Board Games, Miscellaneous Game Compilation, Pirates of the Caribbean Dead Man's Chest: 3 in 1 Pirate Games Collector's Edition, Schöne alte Spiele, Verkade spel",67
Super KGB,68
"The Boardgame Book, Clue / Parcheesi, Gamebook: An Interactive Book of Board Games, Giant 30 Game Cube, Great Board Games, Miscellaneous Game Compilation, Play the Game, Schöne alte Spiele, Tuttiludi, Verkade spel, Winnetou 2",69
The Best of Dragon Magazine Games,70
"5 Alive / Uno, UNO Bundle Collector Tin, UNO Stacko Travel Size Bonus Pak",71
The Games of Middle Earth,72
"Family Game Night Book and Game Set: Scrabble, Clue, Sorry, Yahtzee, Miscellaneous Game Compilation, Scrabble and Yahtzee",73
Spiele-Box,74
Scrabble Plus Scrabble Junior,75
Card Games Around the World,76
"The Boardgame Book, Gamebook: An Interactive Book of Board Games, Miscellaneous Game Compilation",77
"Traveller: The Classic Games, Games 1-6+",78
Reversi Barbacan,79
The Boardgame Book,80
"The Boardgame Book, The Book of Classic Board Games, Five Famous Favorites, Giant 30 Game Cube, Miscellaneous Game Compilation, Schöne alte Spiele",81
"AGON: 24 táblajáték a nagyvilágból, Ancient Board Games, The Boardgame Book, Gamebook: An Interactive Book of Board Games, Senet e Tablan, The Ur Variations",82
"Family Game Night Book and Game Set: Scrabble, Clue, Sorry, Yahtzee, Twin Play Classics: Clue and Sorry",83
3-4-2,84
"The Book of Classic Board Games, Miscellaneous Game Compilation",85
Roads & Boats: &Cetera,86
Zombies!!! Ultimate Collector's Box,87
StarForce Trilogy,88
Risk & Castle Risk,89
Phase 10 Bonus Pack,90
"Carcassonne Big Box, Carcassonne Big Box 5, Carcassonne Big Box 6, Carcassonne Big Box 7, Carcassonne Limited Edition, Carcassonne: 20th Anniversary Edition, Каркассон: Королевский подарок. Новое издание",91
Энергосеть: Россия (Power Grid: Russia),92
"Hive Pocket, Hive Ultimate",93
Alpha Word Game System,94
Play Winning Card Games For Three,95
"The Boardgame Book, Miscellaneous Game Compilation, Play the Game, Surrealist Games",96
"Catan: 25th Anniversary Edition, Catan: Big Box, Catan: Big Box, CATAN: Big Box, Catan: Big Box Jubileumeditie, The Settlers of Catan",97
UNO Stacko Travel Size Bonus Pak,98
A Book of Sandhurst Wargames,99
World in Flames Collector's Edition Super Deluxe,100
"Ancient Board Games, The Boardgame Book",101
"The Best of Dragon Magazine Games, Generic Board ""Square""",102
Trivial Pursuit: Greatest Hits,103
"Carcassonne Big Box, Carcassonne Big Box 2, Carcassonne Big Box 3, Carcassonne Big Box 4, Carcassonne Big Box 5, Carcassonne Big Box 6, Carcassonne Big Box 7, Carcassonne Limited Edition, Каркассон: Королевский Подарок, Каркассон: Предместья и обитатели",104
Knockabout / Warp 6,105
"Puerto Rico, Puerto Rico, Puerto Rico, Puerto Rico 1897",106
Abbott's New Card Games,107
En studie i brott,108
"Lobo: 10° Aniversário, Wilki i Owce (zawiera dodatek Grube Ryby)",109
"Chief Herman's Next Big Thing, Poker Suite",110
"Duit, Jugglegrams",111
Classic Card Game Compendium,112
The Fantasy Trip: Legacy Edition,113
Napoleon at Waterloo,114
Killer Bunnies and the Quest for the Magic Carrot: Deluxe Limited Edition,115
"The 15 Greatest Board Games in the World, The Boardgame Book, The Book of Classic Board Games, Gamebook: An Interactive Book of Board Games, Miscellaneous Game Compilation, Nine Man Morris and The King & The Knights, Play the Game, The Reliquary Collection, Schöne alte Spiele, Verkade spel",116
"Munchkin 1+2, Munchkin 2, 3 & 4, Munchkin 2/3: L'Ascia o Raddoppia, Munchkin Big Box, Munchkin Super-Mega-Set",117
"BANG! 10th Anniversary, BANG! The Bullet!, Wanted! Dead or Alive",118
Big Deal Card Games,119
So spielt die Welt,120
Basic 3,121
The Book of Classic Board Games,122
Great Board Games,123
Ancient Board Games,124
Lifeboat: Deluxe Edition,125
Pizza Wars & Pizza Wars Imperium,126
Alexandros and I Am Spartacus!,127
"The 15 Greatest Board Games in the World, AGON: 24 táblajáték a nagyvilágból, The Boardgame Book, The Book of Classic Board Games, Generic Board ""Alquerq""",128
The Fool's Journey,129
Luck,130
Porsta,131
Five Famous Favorites,132
Blankety Blank / The Price Is Right: Gameshow Duo,133
"Carcassonne Big Box, Carcassonne Big Box 2, Carcassonne Big Box 3, Carcassonne Big Box 4, Carcassonne Big Box 5, Carcassonne Big Box 6, Carcassonne Big Box 7, Carcassonne inklusive Händler & Baumeister, Carcassonne Limited Edition, Каркассон: Королевский Подарок, Каркассон: Предместья и обитатели",134
"Alhambra: Big Box, Alhambra: Big Box (Second Edition), Alhambra: Family & Friends Compact Edition, Alhambra: Family Box, Alhambra: Mega Box",135
Ticket to Ride: 10th Anniversary,136
War of the Ring Collector's Edition,137
Twilight Struggle: 20th Anniversary Hall of Fame Edition,138
Ticket to Ride: Europe - 15th Anniversary,139
파워그리드 재충전 확장: 지도 모음집 (Power Grid Recharged - Map Collection),140
Lords of Vegas,141
"Shogun Big Box, Shogun: Revised Edition",142
Combat Commander: Europe/Med. - 20th Anniversary Edition,143
Thurn und Taxis Big Box,144
Die Säulen der Erde,145
Taluva Deluxe,146
"Power Grid: Benelux/Central Europe, 파워그리드 재충전 확장: 지도 모음집 (Power Grid Recharged - Map Collection)",147
Notre Dame: 10th Anniversary,148
Power Grid: Benelux/Central Europe,149
Куба: Эль Президенте,150
Ticket to Ride Map Collection 2: India & Switzerland,151
Agricola: Special Edition,152
Galaxy Trucker: Anniversary Edition,153
In the Year of the Dragon: 10th Anniversary,154
Race for the Galaxy: Expansion and Brinkmanship,155
Stone Age: Anniversary,156
"Dominion: Big Box, Dominion: Big Box, Dominion: Special Edition",157
"Hoogspanning: Het Verre Oosten, 파워그리드 재충전 확장: 지도 모음집 (Power Grid Recharged - Map Collection)",158
Kingsburg (Third Edition),159
Carson City: Big Box,160
Small World Designer Edition,161
Hansa Teutonica: Big Box,162
Dungeon Lords: Happy Anniversary,163
"Alien Frontiers: Big Box, Alien Frontiers: Edition X",164
Belfort: Edición Limitada,165
"Small World Designer Edition, Small World: Power Pack 2",166
Innovation Deluxe,167
"Fresco: Big Box, Fresco: Mega Box",168
Dominion: Big Box,169
"Ascension: Year Five Collector's Edition, Ascension: Year One Collector's Edition",170
King of Tokyo: Monster Box,171
타케노코: 빅 박스 (Takenoko Big Box),172
"Small World Designer Edition, Small World: Power Pack 1",173
"The Castles of Burgundy, The Castles of Burgundy: Special Edition",174
"Dominion: Alchemisten & Reiche Ernte - Mixbox, Dominion: Big Box, Dominion: Einsteiger-Bigbox, Dominion: Guilds & Cornucopia",175
Madeira Collector's Edition,176
Mage Knight: Ultimate Edition,177
Lancaster: Big Box,178
Last Will,179
"Hanabi & Ikebana, Hanabi Deluxe II, Hanabi Deluxe: What a Show!",180
Village: Big Box,181
"Kingdom Builder: Anniversary Edition, Kingdom Builder: Big Box, Kingdom Builder: Big Box (Second Edition), Kingdom Builder: Empire Edition, Kingdom Builder: Family Box",182
"Escape: Family Box, Escape: The Curse of the Temple - Big Box, Escape: The Curse of the Temple - Big Box Second Edition",183
拉斯維加斯 Las Vegas,184
Snowdonia: Deluxe Master Set,185
Agricola: All Creatures Big and Small - The Big Box,186
"Terra Mystica: Big Box, Terra Mystica: Big Box",187
AEG Black Friday Black Box,188
"Robinson Crusoe: Adventures on the Cursed Island - Collector's Edition (Gamefound Edition), Robinson Crusoe: Adventures on the Cursed Island - Early Launch Kit",189
War of the Ring: Kings and Lords of Middle-Earth - Limited Edition,190
BattleCON: Big Box,191
"Suburbia + Inc., Suburbia: Collector's Edition",192
"Tokaido: Collector's Edition, Tokaido: Deluxe Edition",193
Die Legenden von Andor: Big Box,194
Viticulture: Complete Collector's Edition,195
"Big Game Night 2016, Love Letter: 10th Anniversary Edition, Mein Friedberg Spiel, Princess Wonder",196
"Coup + Reforma, Coup: Deluxe Edition",197
Sushi Go! 10th Anniversary Edition,198
"Dominion: Einsteiger-Bigbox, Dominion: Guilds & Cornucopia",199
Firefly: The Game - 10th Anniversary Collector's Edition,200
Ultimate Railroads,201
"Suburbia + Inc., Suburbia Expansions (Second Edition), Suburbia: Collector's Edition",202
"Star Realms, Star Realms: Deluxe Nova Collection, Звёздные империи. Подарочное издание (Star Realms. Gift Edition)",203
Istanbul: Big Box,204
Dead of Winter: Tabletop Edition,205
"Baseball Highlights: 2045 - Bases Loaded Edition, Baseball Highlights: 2045 - Deluxe Edition, Baseball Highlights: 2045 - Super Deluxe Edition",206
Hive Ultimate,207
Inis: Big Box,208
Port Royal: Big Box,209
Colt Express: Big Box,210
AquaSphere,211
Fields of Arle: Big Box,212
Stockpile: Epic Edition,213
"Trickerion: Anniversary Edition, Trickerion: Collector's Edition",214
Feudum: Big Box,215
Tiny Epic Galaxies: Deluxe Edition,216
"Orléans: Anniversary Box, Orléans: Deluxe Edition",217
San Juan: The Card Game,218
Love Letter: 10th Anniversary Edition,219
Campeones de Midgard: Big Box,220
Mombasa (Limited Edition),221
Food Chain Magnate: Deluxe Edition,222
Isle of Skye: Big Box,223
Manhattan Project: Energy Empire,224
Codenames: Malaysia Edition,225
Star Realms: Deluxe Colonial Collection,226
Orléans: Anniversary Box,227
Oh My Goods!: Big Box,228
"Anachrony Leader Box, Anachrony: Infinity Box",229
Nemo's War: The Ultimate Edition,230
Tyrants of the Underdark: Board Game,231
"51st State: Ultimate Edition, 51st State: Ultimate Edition (Gamefound Edition)",232
Star Trek Ascendancy: The Final Frontier,233
Mystic Vale: Essential Edition,234
Cestou necestou,235
Everdell: Collector's Edition,236
Agricola 15,237
Lorenzo il Magnifico: Big Box,238
Sub Terra: Collector's Edition,239
"Dominion (Second Edition) Big Box, Dominion: Einsteiger-Bigbox",240
Century: Big Box,241
"Rovers van de Noordzee: Helden uit het Noorden, 北海掠奪者：大盒 (North Sea Raiders: Big Box)",242
De Zoektocht naar El Dorado: Big Box,243
"Anachrony Leader Box, Anachrony: Classic Expansion Pack, Anachrony: Infinity Box",244
"Campeones de Midgard: Big Box, Champions of Midgard: Jarl Edition, Чемпионы Мидгарда. Вальхалла и Тёмные горы",245
Rajas of the Ganges: Big Box,246
Teotihuacan: City of Gods - Deluxe Master Set,247
Spirit Island: Feather & Flame,248
Легенды дикого запада (Western Legends),249
Oceans: Legendary Edition,250
Nusfjord: Big Box,251
Root: Jeu de base + La Rivière,252
"Shards of Infinity: Deckbuilding Game, Shards of Infinity: Saga Collection",253
Dice Throne:  Season Two -  Battle Chest Champion Edition,254
"The Quacks of Quedlinburg: Big Box, The Quacks of Quedlinburg: MegaBox, Quacks: All-In Edition",255
Ganz schön clever: Deluxe,256
Newton & Great Discoveries,257
Railroad Ink Challenge: Ultimate Collector's Edition,258
Gùgōng: Deluxe Big Box,259
Sleeping Gods: Kickstarter Edition,260
Between Two Castles: Essential Edition,261
Blitzkrieg!: World War Two in 20 Minutes,262
Everdell: Pearlbrook - Collector's Edition,263
Project L: Kickstarter Edition,264
アンドーンテッド：ノルマンディー・プラス (Undaunted: Normandy Plus),265
It's a Wonderful World: Heritage Edition,266
"Final Girl: S1 Ultimate Box, Final Girl: Starter Set",267
Dune: Kwisatz Haderach Edition,268
Trails of Tucana with Ferry Expansion,269
"Foundations of Rome (Emperor Edition), Foundations of Rome (Maximus Edition)",270
Everdell: Spirecrest - Collector's Edition,271
Everdell: The Complete Collection,272
Marvel Champions: The Card Game - Hero Pack Collection 1,273
Three Sisters Harvest Edition,274
Kemet: Blood and Sand - Kickstarter Edition,275
Creature Comforts (Kickstarter Edition),276
Bonfire: Big Box,277
"Railroad Ink Challenge: Collector's Edition, Railroad Ink Challenge: Ultimate Collector's Edition",278
Cartographers Heroes: Collector's Edition,279
Hegemony: Lead Your Class to Victory - Extended Edition,280
Darwin's Journey: Collector's Edition,281
The Witcher: Old World - Big Box,282
Thunder Road: Vendetta - Maximum Chrome,283
Andromeda's Edge: Deluxe Edition,284
Endeavor: Deep Sea Deluxe Edition,285
Let's Go! To Japan: Matsuri Edition,286
